{
  "name": "Zelotah",
  "rarity": "Epic",
  "element": "Spirit",
  "type": "Assist",
  "rating": {
    "overall": "A",
    "campaign": "A",
    "arena_offense": "A",
    "arena_defense": "A",
    "clan_boss_without_giant_slayer": "A",
    "clan_boss_with_giant_slayer": "",
    "ice_guardian": "A",
    "dragon": "A",
    "spider": "A",
    "fire_knight": "A",
    "minotaur": "A",
    "force_dungeon": "A",
    "magic_dungeon": "A",
    "spirit_dungeon": "A",
    "void_dungeon": "A"
  },
  "slug": "zelotah",
  "characteristics": {
    "60": {
      "hp": 20640,
      "attack": 826,
      "defense": 1101,
      "speed": 95,
      "critical_rate": 0.15,
      "critical_damage": 0.5,
      "resistance": 30,
      "accuracy": 15
    }
  },
  "auras": [
    {
      "raw_description": "Increases Ally RESIST in the Arena by 70.<br> of hy,",
      "effects": []
    }
  ],
  "skills": [
    {
      "name": "Hypnotic Gaze",
      "raw_description": "Attacks 1 enemy. Has a 15% chance of placing a [Sleep] debuff for 1 turn.<br>Damage based on: [ATK]<br>Lvl. 2 Damage +5%<br>Lvl. 3 Buff/Debuff Chance +5%<br>Lvl. 4 Damage +5%<br>Lvl. 5 Buff/Debuff Chance +10%<br>Lvl. 6 Buff/Debuff Chance +10% Ios. ‘a ™ Y, ‘",
      "slug": "hypnotic-gaze",
      "effects": [
        {
          "effect_type": "debuff",
          "type": "Sleep",
          "value": 0,
          "image_slug": "image-debuff-sleep",
          "slug": "sleep",
          "website_link": "/debuff/sleep",
          "extra": false
        }
      ],
      "damaged_based_on": [
        "ATK"
      ]
    },
    {
      "name": "Armored Scales",
      "raw_description": "Places a [Shield] buff on all allies equal to 20% of this Champion's MAX HP for 3 turns. Places a 15% [Continuous Heal] buff on all allies for 2 turns.<br>Lvl. 2 Shield +5%<br>Lvl. 3 Shield +5%<br>Lvl. 4 Shield +5%<br>Lvl. 5 Shield +5%",
      "slug": "armored-scales",
      "effects": [
        {
          "effect_type": "buff",
          "type": "Continuous Heal",
          "value": 0,
          "image_slug": "image-buff-continuous-heal-2",
          "slug": "continuous-heal-2",
          "website_link": "/buff/continuous-heal",
          "extra": true
        },
        {
          "effect_type": "buff",
          "type": "Shield",
          "value": 0,
          "image_slug": "image-buff-shield",
          "slug": "shield",
          "website_link": "/buff/shield",
          "extra": false
        }
      ],
      "damaged_based_on": []
    },
    {
      "name": "Horrid Dreams",
      "raw_description": "Attacks all enemies. Has a 50% chance of placing a [Sleep] debuff for 1 turn. Has a 75% chance against enemies under debuffs.<br>Damage based on: [ATK]<br>Lvl. 2 Damage +10%<br>Lvl. 3 Buff/Debuff Chance +5%<br>Lvl. 4 Buff/Debuff Chance +10%<br>Lvl. 5 Buff/Debuff Chance +10%<br>Lvl. 6 Cooldown -1",
      "slug": "horrid-dreams",
      "effects": [
        {
          "effect_type": "debuff",
          "type": "Sleep",
          "value": 0,
          "image_slug": "image-debuff-sleep",
          "slug": "sleep",
          "website_link": "/debuff/sleep",
          "extra": false
        }
      ],
      "damaged_based_on": [
        "ATK"
      ]
    }
  ],
  "faction": {
    "name": "Undead Hordes",
    "slug": "undead-hordes",
    "website_link": "/factions/undead-hordes/",
    "image_slug": "image-faction-undead-hordes",
    "number_of_champions": 0,
    "default_description": "Undead Hordes is a faction from RAID Shadow Legends",
    "seo": {
      "title": "%%title%% %%page%% %%sep%% %%parent_title%% %%sep%% %%sitename%%",
      "description": "Undead Hordes is a faction from RAID Shadow Legends. Find out more on this Raid Shadow Legends codex.",
      "keywords": [
        "raid",
        "shadow",
        "legends",
        "factions",
        "Undead Hordes",
        "undead-hordes"
      ],
      "structured_data": null
    }
  },
  "faction_slug": "undead-hordes",
  "website_link": "/champions/zelotah/",
  "image_slug": "image-champion-zelotah",
  "seo": {
    "title": "%%title%% %%page%% %%sep%% %%parent_title%% %%sep%% %%sitename%%",
    "description": "Zelotah is a epic assist champion from the faction Undead Hordes doing spirit damage. Find out more on this Raid Shadow Legends codex.",
    "keywords": [
      "raid",
      "shadow",
      "legends",
      "champions",
      "tier",
      "list",
      "Zelotah",
      "zelotah"
    ],
    "structured_data": [
      {
        "@context": "http://schema.org/",
        "@type": "Person",
        "affiliation": {
          "@context": "http://schema.org",
          "@type": "Organization",
          "name": "Undead Hordes"
        },
        "description": "Member of the faction Undead Hordes, Zelotah is a champion of Epic rarity and of Assist type",
        "image": "https://raid-codex.com/wp-content/uploads/champions/image-champion-zelotah.jpg",
        "name": "Zelotah",
        "url": "https://raid-codex.com/champions/zelotah/"
      }
    ]
  },
  "default_description": "Zelotah is a epic assist champion from the faction Undead Hordes doing spirit damage",
  "recommended_builds": [],
  "lore": ""
}
