{
  "name": "Metalshaper",
  "rarity": "Rare",
  "element": "Spirit",
  "type": "Assist",
  "rating": {
    "overall": "B",
    "campaign": "B",
    "arena_offense": "B",
    "arena_defense": "A",
    "clan_boss_without_giant_slayer": "C",
    "clan_boss_with_giant_slayer": "C",
    "ice_guardian": "B",
    "dragon": "B",
    "spider": "D",
    "fire_knight": "C",
    "minotaur": "B",
    "force_dungeon": "C",
    "magic_dungeon": "B",
    "spirit_dungeon": "C",
    "void_dungeon": "B"
  },
  "slug": "metalshaper",
  "characteristics": {
    "60": {
      "hp": 16350,
      "attack": 859,
      "defense": 1079,
      "speed": 90,
      "critical_rate": 0.15,
      "critical_damage": 0.57,
      "resistance": 30,
      "accuracy": 0
    }
  },
  "auras": [],
  "skills": [
    {
      "name": "Transference Bolt",
      "raw_description": "Attacks 1 enemy. Has a 30% chance of stealing 1 random buff from the target.<br>Damage based on: [DEF]<br>Lvl. 2 Damage +5%<br>Lvl. 3 Buff/Debuff Chance +5%<br>Lvl. 4 Damage +5%<br>Lvl. 5 Buff/Debuff Chance +5%<br>Lvl. 6 Damage +5%<br>Lvl. 7 Buff/Debuff Chance +5%",
      "slug": "transference-bolt",
      "effects": [],
      "damaged_based_on": [
        "DEF"
      ]
    },
    {
      "name": "Fortified Steel",
      "raw_description": "Places a [Shield] buff on all allies for 2 turns. The value of [Shield] is proportional to this Champion Level.<br>Lvl. 2 Shield +5%<br>Lvl. 3 Shield +5%<br>Lvl. 4 Shield +10%<br>Lvl. 5 Cooldown -1",
      "slug": "fortified-steel",
      "effects": [
        {
          "effect_type": "buff",
          "type": "Shield",
          "value": 0,
          "image_slug": "image-buff-shield",
          "slug": "shield",
          "website_link": "/buffs/shield",
          "extra": false,
          "raw_description": ""
        }
      ],
      "damaged_based_on": []
    },
    {
      "name": "Rescue",
      "raw_description": "Removes all debuffs from an ally with the lowest HP, then heals this ally by 20% of this Champion MAX HP. Places a 25% [Increase DEF] buff on the target for 3 turns.<br>Lvl. 2 Heal +10%<br>Lvl. 3 Heal +10%<br>Lvl. 4 Cooldown -1",
      "slug": "rescue",
      "effects": [
        {
          "effect_type": "buff",
          "type": "Increase DEF",
          "value": 0,
          "image_slug": "image-buff-increase-def",
          "slug": "increase-def",
          "website_link": "/buffs/increase-def",
          "extra": false,
          "raw_description": ""
        }
      ],
      "damaged_based_on": []
    }
  ],
  "faction": {
    "name": "Lizardmen",
    "slug": "lizardmen",
    "website_link": "/factions/lizardmen/",
    "image_slug": "image-faction-lizardmen",
    "number_of_champions": 0,
    "default_description": "Lizardmen is a faction from RAID Shadow Legends",
    "seo": {
      "title": "%%title%% %%page%% %%sep%% %%parent_title%% %%sep%% %%sitename%%",
      "description": "Lizardmen is a faction from RAID Shadow Legends. Find out more on this Raid Shadow Legends codex.",
      "keywords": [
        "raid",
        "shadow",
        "legends",
        "factions",
        "Lizardmen",
        "lizardmen"
      ],
      "structured_data": null
    }
  },
  "faction_slug": "lizardmen",
  "website_link": "/champions/metalshaper/",
  "image_slug": "image-champion-metalshaper",
  "seo": {
    "title": "%%title%% %%page%% %%sep%% %%parent_title%% %%sep%% %%sitename%%",
    "description": "Metalshaper is a rare assist champion from the faction Lizardmen doing spirit damage. Find out more on this Raid Shadow Legends codex.",
    "keywords": [
      "raid",
      "shadow",
      "legends",
      "champions",
      "tier",
      "list",
      "Metalshaper",
      "metalshaper"
    ],
    "structured_data": [
      {
        "@context": "http://schema.org/",
        "@type": "Person",
        "affiliation": {
          "@context": "http://schema.org",
          "@type": "Organization",
          "name": "Lizardmen"
        },
        "description": "Member of the faction Lizardmen, Metalshaper is a champion of Rare rarity and of Assist type",
        "image": "https://raid-codex.com/wp-content/uploads/champions/image-champion-metalshaper.jpg",
        "name": "Metalshaper",
        "url": "https://raid-codex.com/champions/metalshaper/"
      }
    ]
  },
  "default_description": "Metalshaper is a rare assist champion from the faction Lizardmen doing spirit damage",
  "recommended_builds": [],
  "lore": ""
}
