{
  "name": "Theurgist",
  "rarity": "Rare",
  "element": "Magic",
  "type": "Assist",
  "rating": {
    "overall": "B",
    "campaign": "C",
    "arena_offense": "B",
    "arena_defense": "B",
    "clan_boss_without_giant_slayer": "C",
    "clan_boss_with_giant_slayer": "",
    "ice_guardian": "B",
    "dragon": "B",
    "spider": "C",
    "fire_knight": "C",
    "minotaur": "B",
    "force_dungeon": "C",
    "magic_dungeon": "C",
    "spirit_dungeon": "C",
    "void_dungeon": "B"
  },
  "slug": "theurgist",
  "characteristics": {
    "60": {
      "hp": 18495,
      "attack": 947,
      "defense": 848,
      "speed": 103,
      "critical_rate": 0.15,
      "critical_damage": 0.5,
      "resistance": 30,
      "accuracy": 0
    }
  },
  "auras": [],
  "skills": [
    {
      "name": "Ice Debris",
      "raw_description": "Attacks 1 enemy. Fills the Turn Meter for a random ally by 10%.<br>Damage based on: [ATK]<br>Lvl. 2 Damage +5%<br>Lvl. 3 Damage +5%<br>Lvl. 4 Damage +5%<br>Lvl. 5 Damage +5%",
      "slug": "ice-debris",
      "effects": [],
      "damaged_based_on": [
        "ATK"
      ]
    },
    {
      "name": "Touch of Sealing",
      "raw_description": "Attacks 1 enemy. Has a 75% chance of placing a [Block Buffs] debuff for 1 turn.<br>Damage based on: [ATK]<br>Lvl. 2 Damage +5%<br>Lvl. 3 Damage +5%<br>Lvl. 4 Buff/Debuff Chance +10%<br>Lvl. 5 Buff/Debuff Chance +15%<br>Lvl. 6 Cooldown -1 ane",
      "slug": "touch-of-sealing",
      "effects": [
        {
          "effect_type": "debuff",
          "type": "Block Buffs",
          "value": 0,
          "image_slug": "image-debuff-block-buffs",
          "slug": "block-buffs",
          "website_link": "/debuffs/block-buffs",
          "extra": false,
          "raw_description": ""
        }
      ],
      "damaged_based_on": [
        "ATK"
      ]
    },
    {
      "name": "Uplift",
      "raw_description": "Places a 30% [Increase DEF] buff and a 25% [Increase ATK] buff on all allies for 2 turns.<br>Lvl. 2 Cooldown -1<br>Lvl. 3 Cooldown -1",
      "slug": "uplift",
      "effects": [
        {
          "effect_type": "buff",
          "type": "Increase ATK",
          "value": 0,
          "image_slug": "image-buff-increase-atk",
          "slug": "increase-atk",
          "website_link": "/buffs/increase-atk",
          "extra": false,
          "raw_description": ""
        },
        {
          "effect_type": "buff",
          "type": "Increase DEF",
          "value": 0,
          "image_slug": "image-buff-increase-def",
          "slug": "increase-def",
          "website_link": "/buffs/increase-def",
          "extra": false,
          "raw_description": ""
        }
      ],
      "damaged_based_on": []
    }
  ],
  "faction": {
    "name": "Knight Revenant",
    "slug": "knight-revenant",
    "website_link": "/factions/knight-revenant/",
    "image_slug": "image-faction-knight-revenant",
    "number_of_champions": 0,
    "default_description": "Knight Revenant is a faction from RAID Shadow Legends",
    "seo": {
      "title": "%%title%% %%page%% %%sep%% %%parent_title%% %%sep%% %%sitename%%",
      "description": "Knight Revenant is a faction from RAID Shadow Legends. Find out more on this Raid Shadow Legends codex.",
      "keywords": [
        "raid",
        "shadow",
        "legends",
        "factions",
        "Knight Revenant",
        "knight-revenant"
      ],
      "structured_data": null
    }
  },
  "faction_slug": "knight-revenant",
  "website_link": "/champions/theurgist/",
  "image_slug": "image-champion-theurgist",
  "seo": {
    "title": "%%title%% %%page%% %%sep%% %%parent_title%% %%sep%% %%sitename%%",
    "description": "Theurgist is a rare assist champion from the faction Knight Revenant doing magic damage. Find out more on this Raid Shadow Legends codex.",
    "keywords": [
      "raid",
      "shadow",
      "legends",
      "champions",
      "tier",
      "list",
      "Theurgist",
      "theurgist"
    ],
    "structured_data": [
      {
        "@context": "http://schema.org/",
        "@type": "Person",
        "affiliation": {
          "@context": "http://schema.org",
          "@type": "Organization",
          "name": "Knight Revenant"
        },
        "description": "Member of the faction Knight Revenant, Theurgist is a champion of Rare rarity and of Assist type",
        "image": "https://raid-codex.com/wp-content/uploads/champions/image-champion-theurgist.jpg",
        "name": "Theurgist",
        "url": "https://raid-codex.com/champions/theurgist/"
      }
    ]
  },
  "default_description": "Theurgist is a rare assist champion from the faction Knight Revenant doing magic damage",
  "recommended_builds": [],
  "lore": ""
}
