{
  "name": "Kael",
  "rarity": "Rare",
  "element": "Magic",
  "type": "Attack",
  "rating": {
    "overall": "A",
    "campaign": "A",
    "arena_offense": "A",
    "arena_defense": "B",
    "clan_boss_without_giant_slayer": "S",
    "clan_boss_with_giant_slayer": "",
    "ice_guardian": "A",
    "dragon": "B",
    "spider": "A",
    "fire_knight": "A",
    "minotaur": "A",
    "force_dungeon": "A",
    "magic_dungeon": "A",
    "spirit_dungeon": "A",
    "void_dungeon": "A"
  },
  "slug": "kael",
  "characteristics": {
    "60": {
      "hp": 13710,
      "attack": 1200,
      "defense": 914,
      "speed": 103,
      "critical_rate": 0.15,
      "critical_damage": 0.57,
      "resistance": 30,
      "accuracy": 0
    }
  },
  "auras": [
    {
      "raw_description": "Increases Ally HP in all Battles by 15%.",
      "effects": []
    }
  ],
  "skills": [
    {
      "name": "Dark Bolt",
      "raw_description": "Attacks 1 enemy. Has an 80% chance of placing a 2.5% [Poison] debuff for 2 turns.<br>Damage based on: [ATK]<br>Lvl. 2 Damage +5%<br>Lvl. 3 Buff/Debuff Chance +10%<br>Lvl. 4 Damage +5%<br>Lvl. 5 Buff/Debuff Chance +10%<br>Lvl. 6 Damage +10%",
      "slug": "dark-bolt",
      "effects": [
        {
          "effect_type": "debuff",
          "type": "Poison",
          "value": 0,
          "image_slug": "image-debuff-poison-2",
          "slug": "poison-2",
          "website_link": "/debuff/poison",
          "extra": true
        }
      ],
      "damaged_based_on": [
        "ATK"
      ]
    },
    {
      "name": "Acid Rain",
      "raw_description": "Attacks all enemies. Has an extra 15% chance of inflicting a critical killed.<br>Damage based on: [ATK]<br>Lvl. 2 Damage +5%<br>Lvl. 3 Damage +5%<br>Lvl. 4 Damage +5%<br>Lvl. 5 Damage +5%",
      "slug": "acid-rain",
      "effects": [],
      "damaged_based_on": [
        "ATK"
      ]
    },
    {
      "name": "Disintegrate",
      "raw_description": "Attacks 4 times at random. Has a 40% chance of placing a 5% [Poison] debuff for 2 turns.<br>Damage based on: [ATK]<br>Lvl. 2 Damage +10%<br>Lvl. 3 Buff/Debuff Chance +5%<br>Lvl. 4 Damage +10%<br>Lvl. 5 Buff/Debuff Chance +5%<br>Lvl. 6 Cooldown -1",
      "slug": "disintegrate",
      "effects": [
        {
          "effect_type": "debuff",
          "type": "Poison",
          "value": 0,
          "image_slug": "image-debuff-poison-2",
          "slug": "poison-2",
          "website_link": "/debuff/poison",
          "extra": true
        }
      ],
      "damaged_based_on": [
        "ATK"
      ]
    }
  ],
  "faction": {
    "name": "Dark Elves",
    "slug": "dark-elves",
    "website_link": "/factions/dark-elves/",
    "image_slug": "image-faction-dark-elves",
    "number_of_champions": 0,
    "default_description": "Dark Elves is a faction from RAID Shadow Legends",
    "seo": {
      "title": "%%title%% %%page%% %%sep%% %%parent_title%% %%sep%% %%sitename%%",
      "description": "Dark Elves is a faction from RAID Shadow Legends. Find out more on this Raid Shadow Legends codex.",
      "keywords": [
        "raid",
        "shadow",
        "legends",
        "factions",
        "Dark Elves",
        "dark-elves"
      ],
      "structured_data": null
    }
  },
  "faction_slug": "dark-elves",
  "website_link": "/champions/kael/",
  "image_slug": "image-champion-kael",
  "seo": {
    "title": "%%title%% %%page%% %%sep%% %%parent_title%% %%sep%% %%sitename%%",
    "description": "Kael is a rare attack champion from the faction Dark Elves doing magic damage. Find out more on this Raid Shadow Legends codex.",
    "keywords": [
      "raid",
      "shadow",
      "legends",
      "champions",
      "tier",
      "list",
      "Kael",
      "kael"
    ],
    "structured_data": [
      {
        "@context": "http://schema.org/",
        "@type": "Person",
        "affiliation": {
          "@context": "http://schema.org",
          "@type": "Organization",
          "name": "Dark Elves"
        },
        "description": "Member of the faction Dark Elves, Kael is a champion of Rare rarity and of Attack type",
        "image": "https://raid-codex.com/wp-content/uploads/champions/image-champion-kael.jpg",
        "name": "Kael",
        "url": "https://raid-codex.com/champions/kael/"
      }
    ]
  },
  "default_description": "Kael is a rare attack champion from the faction Dark Elves doing magic damage",
  "recommended_builds": [],
  "lore": ""
}
