{
  "name": "Warmaiden",
  "rarity": "Rare",
  "element": "Force",
  "type": "Attack",
  "rating": {
    "overall": "A",
    "campaign": "B",
    "arena_offense": "A",
    "arena_defense": "B",
    "clan_boss_without_giant_slayer": "A",
    "clan_boss_with_giant_slayer": "B",
    "ice_guardian": "A",
    "dragon": "A",
    "spider": "B",
    "fire_knight": "C",
    "minotaur": "A",
    "force_dungeon": "A",
    "magic_dungeon": "C",
    "spirit_dungeon": "B",
    "void_dungeon": "B"
  },
  "slug": "warmaiden",
  "characteristics": {
    "60": {
      "hp": 14700,
      "attack": 1321,
      "defense": 727,
      "speed": 97,
      "critical_rate": 0.15,
      "critical_damage": 0.57,
      "resistance": 30,
      "accuracy": 0
    }
  },
  "auras": [],
  "skills": [
    {
      "name": "Ferocious Attack",
      "raw_description": "Attacks 1 enemy. Has a 30% chance of placing a 2.5% [Poison] debuff for 1 turn.<br>Damage based on: [ATK]<br>Lvl. 2 Damage +5%<br>Lvl. 3 Damage +5%<br>Lvl. 4 Damage +10%<br>Lvl. 5 Damage +10%<br>Lvl. 6 Damage +10%",
      "slug": "ferocious-attack",
      "effects": [
        {
          "effect_type": "debuff",
          "type": "Poison",
          "value": 0,
          "image_slug": "image-debuff-poison-2",
          "slug": "poison-2",
          "website_link": "/debuff/poison",
          "extra": true
        }
      ],
      "damaged_based_on": [
        "ATK"
      ]
    },
    {
      "name": "Opportunity Strike",
      "raw_description": "Attacks 1 enemy. Places a 50% [Increase ATK] buff on this Champion and places an extra hit if this attack is critical. The extra hit cannot be critical.<br>Damage based on: [ATK]<br>Lvl. 2 Damage +5%<br>Lvl. 3 Damage +5%<br>Lvl. 4 Damage +5%<br>Lvl. 5 Damage +5%",
      "slug": "opportunity-strike",
      "effects": [
        {
          "effect_type": "buff",
          "type": "Increase ATK",
          "value": 0,
          "image_slug": "image-buff-increase-atk-2",
          "slug": "increase-atk-2",
          "website_link": "/buff/increase-atk",
          "extra": true
        }
      ],
      "damaged_based_on": [
        "ATK"
      ]
    },
    {
      "name": "Crumbling Blast",
      "raw_description": "Attacks all enemies. Has a 75% chance of placing a 60% [Decrease DEF] debuff for 2 turns.<br>Damage based on: [ATK]<br>Lvl. 2 Damage +10%<br>Lvl. 3 Buff/Debuff Chance +10<br>Lvl. 4 Buff/Debuff Chance +159<br>Lvl. 5 Cooldown -1",
      "slug": "crumbling-blast",
      "effects": [
        {
          "effect_type": "debuff",
          "type": "Decrease DEF",
          "value": 0,
          "image_slug": "image-debuff-decrease-def-2",
          "slug": "decrease-def-2",
          "website_link": "/debuff/decrease-def",
          "extra": true
        }
      ],
      "damaged_based_on": [
        "ATK"
      ]
    }
  ],
  "faction": {
    "name": "Barbarians",
    "slug": "barbarians",
    "website_link": "/factions/barbarians/",
    "image_slug": "image-faction-barbarians",
    "number_of_champions": 0,
    "default_description": "Barbarians is a faction from RAID Shadow Legends",
    "seo": {
      "title": "%%title%% %%page%% %%sep%% %%parent_title%% %%sep%% %%sitename%%",
      "description": "Barbarians is a faction from RAID Shadow Legends. Find out more on this Raid Shadow Legends codex.",
      "keywords": [
        "raid",
        "shadow",
        "legends",
        "factions",
        "Barbarians",
        "barbarians"
      ],
      "structured_data": null
    }
  },
  "faction_slug": "barbarians",
  "website_link": "/champions/warmaiden/",
  "image_slug": "image-champion-warmaiden",
  "seo": {
    "title": "%%title%% %%page%% %%sep%% %%parent_title%% %%sep%% %%sitename%%",
    "description": "Warmaiden is a rare attack champion from the faction Barbarians doing force damage. Find out more on this Raid Shadow Legends codex.",
    "keywords": [
      "raid",
      "shadow",
      "legends",
      "champions",
      "tier",
      "list",
      "Warmaiden",
      "warmaiden"
    ],
    "structured_data": [
      {
        "@context": "http://schema.org/",
        "@type": "Person",
        "affiliation": {
          "@context": "http://schema.org",
          "@type": "Organization",
          "name": "Barbarians"
        },
        "description": "Member of the faction Barbarians, Warmaiden is a champion of Rare rarity and of Attack type",
        "image": "https://raid-codex.com/wp-content/uploads/champions/image-champion-warmaiden.jpg",
        "name": "Warmaiden",
        "url": "https://raid-codex.com/champions/warmaiden/"
      }
    ]
  },
  "default_description": "Warmaiden is a rare attack champion from the faction Barbarians doing force damage",
  "recommended_builds": [],
  "lore": ""
}
