{
  "name": "Lemure",
  "rarity": "Uncommon",
  "element": "",
  "type": "HP",
  "rating": {
    "overall": "D",
    "campaign": "",
    "arena_offense": "",
    "arena_defense": "",
    "clan_boss_without_giant_slayer": "",
    "clan_boss_with_giant_slayer": "",
    "ice_guardian": "",
    "dragon": "",
    "spider": "",
    "fire_knight": "",
    "minotaur": "",
    "force_dungeon": "",
    "magic_dungeon": "",
    "spirit_dungeon": "",
    "void_dungeon": ""
  },
  "slug": "lemure",
  "characteristics": {
    "60": {
      "hp": 18165,
      "attack": 639,
      "defense": 903,
      "speed": 93,
      "critical_rate": 0.15,
      "critical_damage": 0.5,
      "resistance": 30,
      "accuracy": 0
    }
  },
  "auras": [],
  "skills": [
    {
      "name": "Vicious Swipes",
      "raw_description": "Attacks 1 enemy 2 times.<br>Damage based on: [ATK]<br>Lvl. 2 Damage +5%<br>Lvl. 3 Damage +5%<br>Lvl. 4 Damage +5%",
      "slug": "vicious-swipes",
      "effects": [],
      "damaged_based_on": [
        "ATK"
      ]
    },
    {
      "name": "Dark Burst",
      "raw_description": "Attacks 1 enemy. Has a 60% chance of placing a [Bomb] that detonates in 3 turns.<br>Damage based on: [ATK] [HP]<br>Lvl. 2 Damage +5%<br>Lvl. 3 Buff/Debuff Chance +5%<br>Lvl. 4 Damage +10%<br>Lvl. 5 Buff/Debuff Chance +10%",
      "slug": "dark-burst",
      "effects": [
        {
          "effect_type": "debuff",
          "type": "Bomb",
          "value": 0,
          "image_slug": "image-debuff-bomb",
          "slug": "bomb",
          "website_link": "/debuffs/bomb",
          "extra": false,
          "raw_description": ""
        }
      ],
      "damaged_based_on": [
        "ATK",
        "HP"
      ]
    }
  ],
  "faction": {
    "name": "Demonspawn",
    "slug": "demonspawn",
    "website_link": "/factions/demonspawn/",
    "image_slug": "image-faction-demonspawn",
    "number_of_champions": 0,
    "default_description": "Demonspawn is a faction from RAID Shadow Legends",
    "seo": {
      "title": "%%title%% %%page%% %%sep%% %%parent_title%% %%sep%% %%sitename%%",
      "description": "Demonspawn is a faction from RAID Shadow Legends. Find out more on this Raid Shadow Legends codex.",
      "keywords": [
        "raid",
        "shadow",
        "legends",
        "factions",
        "Demonspawn",
        "demonspawn"
      ],
      "structured_data": null
    }
  },
  "faction_slug": "demonspawn",
  "website_link": "/champions/lemure/",
  "image_slug": "image-champion-lemure",
  "seo": {
    "title": "%%title%% %%page%% %%sep%% %%parent_title%% %%sep%% %%sitename%%",
    "description": "Lemure is a uncommon hp champion from the faction Demonspawn. Find out more on this Raid Shadow Legends codex.",
    "keywords": [
      "raid",
      "shadow",
      "legends",
      "champions",
      "tier",
      "list",
      "Lemure",
      "lemure"
    ],
    "structured_data": [
      {
        "@context": "http://schema.org/",
        "@type": "Person",
        "affiliation": {
          "@context": "http://schema.org",
          "@type": "Organization",
          "name": "Demonspawn"
        },
        "description": "Member of the faction Demonspawn, Lemure is a champion of Uncommon rarity and of HP type",
        "image": "https://raid-codex.com/wp-content/uploads/champions/image-champion-lemure.jpg",
        "name": "Lemure",
        "url": "https://raid-codex.com/champions/lemure/"
      }
    ]
  },
  "default_description": "Lemure is a uncommon hp champion from the faction Demonspawn",
  "recommended_builds": [],
  "lore": ""
}
